,Review
307,that is the biggest complain
308,most of the experience is quite good.
309,"however, there is no any opening windows in my room."
310,so there are no any fresh air inside.
311,this affects my mental health.
312,good management and security on site.
313,"bikes are not covered in the insurance policy, so be careful, mine was stolen."
314,poor wifi (always under maintenance).
315,"all round a good experience living here, but would recommend living in a flat with friends, to avoid uncomfortable living situations with random flat mates."
316,"would recommend for first year students, definitely not for postgraduate students."
